{
  "$schema": "../../schemas/canonical-decision.schema.json",
  "schema_version": "0.1.0",
  "decision_id": "canonical-decision:mythic-spell-variant.deep-slumber:v0.1",
  "entity_id": "mythic-spell-variant.deep-slumber",
  "canonical_record_path": "../variants/mythic-deep-slumber.json",
  "observation_ids": [
    "aon:spell.deep-slumber:91df12197dc9cb6f"
  ],
  "policy_id": "mythic-magic-cost-expression-v1",
  "baseline_observation_id": "aon:spell.deep-slumber:91df12197dc9cb6f",
  "status": "accepted",
  "field_decisions": [
    {
      "canonical_path": "/rules_text/raw",
      "decision": "select_source",
      "selected_evidence": [
        {
          "observation_id": "aon:spell.deep-slumber:91df12197dc9cb6f",
          "source_field": "raw_aon_mythic_section"
        }
      ],
      "considered_observation_ids": [
        "aon:spell.deep-slumber:91df12197dc9cb6f"
      ],
      "rationale": "AoN's explicitly named mythic subsection is the available first-party source evidence."
    },
    {
      "canonical_path": "/publication",
      "decision": "normalize",
      "selected_evidence": [
        {
          "observation_id": "aon:spell.deep-slumber:91df12197dc9cb6f",
          "source_field": "raw_aon_mythic_section"
        }
      ],
      "considered_observation_ids": [
        "aon:spell.deep-slumber:91df12197dc9cb6f"
      ],
      "rationale": "The source citation is separated from the copied rules text."
    },
    {
      "canonical_path": "/augmentations/0/cost_expression",
      "decision": "derived",
      "selected_evidence": [
        {
          "observation_id": "aon:spell.deep-slumber:91df12197dc9cb6f",
          "source_field": "raw_aon_mythic_section"
        }
      ],
      "considered_observation_ids": [
        "aon:spell.deep-slumber:91df12197dc9cb6f"
      ],
      "rationale": "The source states alternative totals or a base cost plus a stated per-unit cost; the structured expression preserves those mechanics without inventing one scalar total."
    },
    {
      "canonical_path": "/normalization/status",
      "decision": "normalize",
      "selected_evidence": [
        {
          "observation_id": "aon:spell.deep-slumber:91df12197dc9cb6f",
          "source_field": "raw_aon_mythic_section"
        }
      ],
      "considered_observation_ids": [
        "aon:spell.deep-slumber:91df12197dc9cb6f"
      ],
      "rationale": "The source-backed mythic text, base-spell relationship, tier, and mythic-power cost mechanics are complete. Detailed effects remain lossless rules text."
    }
  ],
  "relationship_decisions": [
    {
      "relationship_id": "mythic-spell-variant.deep-slumber:mythic_version_of:spell.deep-slumber",
      "decision": "accept",
      "evidence": [
        {
          "observation_id": "aon:spell.deep-slumber:91df12197dc9cb6f",
          "source_field": "raw_aon_mythic_section"
        }
      ],
      "considered_observation_ids": [
        "aon:spell.deep-slumber:91df12197dc9cb6f"
      ],
      "rationale": "AoN labels this section with the mythic version's exact name."
    }
  ],
  "unresolved_questions": []
}
